ID,Sheet,Policy,Text
13372,SUMMARY_OF_SIGNIFICANT_ACCOUNT,L.       Operating Expenses,"Costs related to fuel and natural gas included in Purchased Power, Fuel and Transmission on the statements of income were as follows:(1) NSTAR Gas natural gas costs were included in NU beginning April 10, 2012."
13372,SUMMARY_OF_SIGNIFICANT_ACCOUNT,M.       Allowance for Funds Used During Construction,"AFUDC represents the cost of borrowed and equity funds used to finance construction and is included in the cost of the Regulated companies' utility plant. The portion of AFUDC attributable to borrowed funds is recorded as a reduction of Other Interest Expense, and the AFUDC related to equity funds is recorded as Other Income, Net on the statements of income. AFUDC costs are recovered from customers over the service life of the related plant in the form of increased revenue collected as a result of higher depreciation expense.The Regulated companies' average AFUDC rate is based on a FERC-prescribed formula using the cost of a company's short-term financings and capitalization (preferred stock, long-term debt and common equity), as appropriate. The average rate is applied to average eligible CWIP amounts to calculate AFUDC.(1) NSTAR amounts were included in NU beginning April 10, 2012."
13372,SUMMARY_OF_SIGNIFICANT_ACCOUNT,"N.       Other Income, Net","Items included within Other Income, Net on the statements of income primarily consist of investment income/(loss), interest income, AFUDC related to equity funds, and equity in earnings. Investment income/(loss) primarily relates to debt and equity securities held in trust. For further information, see Note 5, ""Marketable Securities,"" to the financial statements. For further information on AFUDC related to equity funds, see Note 1M, ""Summary of Significant Accounting Policies – Allowance for Funds Used During Construction,"" to the financial statements. "
13372,SUMMARY_OF_SIGNIFICANT_ACCOUNT,O.       Other Taxes,Gross receipts taxes levied by the state of Connecticut are collected by CL&P and Yankee Gas from their respective customers. These gross receipts taxes are shown on a gross basis with collections in Operating Revenues and payments in Taxes Other Than Income Taxes on the statements of income as follows:Certain sales taxes are collected by NU's companies that serve customers in Connecticut and Massachusetts as agents for state and local governments and are recorded on a net basis with no impact on the statements of income. 
13372,SUMMARY_OF_SIGNIFICANT_ACCOUNT,Cash Paid/(Received) During the Year for:,
13372,SUMMARY_OF_SIGNIFICANT_ACCOUNT,Non-Cash Investing Activities:,"(1) NSTAR amounts were included in NU beginning April 10, 2012."
13372,SUMMARY_OF_SIGNIFICANT_ACCOUNT,Cash Paid/(Received) During the Year for: ,
13372,SUMMARY_OF_SIGNIFICANT_ACCOUNT,Non-Cash Investing Activities:,"In 2014, as a result of damages awarded to the Yankee Companies for spent nuclear fuel lawsuits against the DOE described in Note 11C, ""Commitments and Contingencies - Contractual Obligations - Yankee Companies,"" NU received total proceeds of $132.1 million, which were net of $80.6 million in proceeds CYAPC and YAEC returned to non-affiliated member companies. The merger of NU with NSTAR on April 10, 2012 represented a significant non-cash transaction. Refer to Note 21, ""Merger of NU and NSTAR,"" for further information."
13372,SUMMARY_OF_SIGNIFICANT_ACCOUNT,Q.       Related Parties,"NUSCO, NU's service company, provides centralized accounting, administrative, engineering, financial, information technology, legal, operational, planning, purchasing, and other services to NU's companies. The Rocky River Realty Company, Renewable Properties, Inc. and Properties, Inc., three other NU subsidiaries, construct, acquire or lease some of the property and facilities used by NU's companies. As of both December 31, 2014 and 2013, CL&P, PSNH and WMECO had long-term receivables from NUSCO in the amounts of $25 million, $3.8 million and $5.5 million, respectively, which were included in Other Long-Term Assets on the balance sheets. These amounts related to the funding of investments held in trust by NUSCO in connection with certain postretirement benefits for CL&P, PSNH and WMECO employees and have been eliminated in consolidation on the NU financial statements.Included in the CL&P, NSTAR Electric, PSNH and WMECO balance sheets as of December 31, 2014 and 2013 were Accounts Receivable from Affiliated Companies and Accounts Payable to Affiliated Companies relating to transactions between CL&P, NSTAR Electric, PSNH and WMECO and other subsidiaries that are wholly-owned by NU. These amounts have been eliminated in consolidation on the NU financial statements."
13372,SUMMARY_OF_SIGNIFICANT_ACCOUNT,R.       Severance Benefits,"For the years ended December 31, 2014 and 2013, NU recorded severance benefit expenses of $15 million and $9.7 million, respectively, in connection with the partial outsourcing of information technology functions and facilities closures, as well as ongoing post-merger integration. As of December 31, 2014 and 2013, the severance accrual totaled $10.4 million and $14.7 million, respectively, and was included in Other Current Liabilities on the balance sheets."
